{
  "contract_version": "1.0",
  "exhibit_id": "D-001",
  "last_modified": "2026-06-15T03:00:00Z",
  "pages": {
    "0": [
      {
        "id": "11111111-1111-1111-1111-111111111111",
        "tool": "highlight",
        "color": "#FFD60AFF",
        "bounds": { "x": 0.1, "y": 0.2, "w": 0.3, "h": 0.05 }
      },
      {
        "id": "22222222-2222-2222-2222-222222222222",
        "tool": "callout",
        "color": "#0A84FFFF",
        "bounds":         { "x": 0.6, "y": 0.6, "w": 0.3, "h": 0.2 },
        "callout_source": { "x": 0.1, "y": 0.1, "w": 0.2, "h": 0.1 }
      },
      {
        "id": "33333333-3333-3333-3333-333333333333",
        "tool": "freehand",
        "color": "#FF453AFF",
        "ink_data_base64": ""
      }
    ]
  }
}
